Need ID,Title,Text,Link,Keywords
add,Find your MP - UK Parliament,"Search for a Member of Parliament (MP) by name, constituency or postcode",http://findyourmp.parliament.uk/,"mp, local mp, my mp, your mp, who is my mp, find my mp, member of parliament, mps, mp's, contact details, address, write, email"
add,GDS blog,The Government Digital Service (GDS) blog about how the government is transforming digital public services,http://digital.cabinetoffice.gov.uk/,"gds blog, blogs"
2062,Internships - Graduate Talent Pool,Find an internship with a business on the Graduate Talent Pool website,http://graduatetalentpool.direct.gov.uk/,"graduate, graduates, intern, interns, internship, internships"
add,Public Appointments - Cabinet Office,Current opportunities to serve on the boards of public bodies and on a range of government committees,http://publicappointments.cabinetoffice.gov.uk/,public appointments
add,Government Digital Strategy,How the government will redesign its digital services to make them so straightforward and convenient that all those who can use them prefer to do so,http://publications.cabinetoffice.gov.uk/digital/,"government digital strategy, digital strategy"
add,CSCS - Construction Skills Certification Scheme,CSCS cards give people who work on construction sites proof of their identity and competence,http://www.cscs.uk.com/,"cscs, cscs card, cscs test, health and safety test, apply, applying, book, booking, building site"
add,Data.gov.uk - opening up government,Public data to help people understand how the government works and how policies are made,http://www.data.gov.uk/,"data, open data, big data, raw data, transparency, dataset, datasets, developers, api, sparql"
add,Flood warnings - Environment Agency,Find out whether there are any flood warnings in your area,http://www.environment-agency.gov.uk/homeandleisure/floods/31618.aspx,"flood, floods, flooding, flood warning, flood warnings"
add,Equality and Human Rights Commission (EHRC),Find out about your rights and EHRC's role in promoting and monitoring human rights,http://www.equalityhumanrights.com/human-rights/,human rights
1379,Complain about a train or bus journey - FixMyTransport,Report public transport problems to the company responsible using FixMyTransport,http://www.fixmytransport.com/,"complain about public transport, train journey complaint, bus journey complaint, complain about train company, complain about train journey, complain about bus company, complain about bus journey"
add,Food hygiene ratings - Food Standards Agency,"Find out if a restaurant, takeaway or food shop has good food hygiene standards",http://www.food.gov.uk/ratings,"food hygiene, rating, ratings, safety, standards, inspectors, inspection, fsa"
add,Chalara dieback of ash - Forestry Commission,Chalara dieback of ash is a serious disease of ash trees that causes leaf loss and crown dieback and it can lead to tree death,http://www.forestry.gov.uk/chalara,"ash, ash tree, ash tree dieback, dieback, Chalara, Chalara dieback, Chalara fraxinea, tree, tree health"
add,Get Safe Online,"Advice on how to protect yourself, your children or your business against fraud, identity theft, viruses and other problems online",http://www.getsafeonline.org/,"internet safety, children internet safety"
add,HM Revenue & Customs,Information and online services from HM Revenue & Customs (HMRC),http://www.hmrc.gov.uk/,"hmrc, tax, taxes"
1710,Contact HM Revenue & Customs - HMRC,Find the right contact details for your enquiry to HM Revenue & Customs (HMRC),http://www.hmrc.gov.uk/contactus/,"contact hmrc, contact hm revenue and customs"
add,Enterprise Investment Scheme - HMRC,An overview of the Enterprise Investment Scheme (EIS) for companies and potential investors,http://www.hmrc.gov.uk/eis/,"enterprise investment, eis"
add,PAYE for employers - HMRC,"Information and tools from HM Revenue & Customs (HMRC) to help you deal with PAYE, National Insurance, expenses and benefits",http://www.hmrc.gov.uk/payerti/,"paye, paye tools, payetools, basicpayetools, basicpaytools, rti, real time information"
1890,HomeBuy,Find the HomeBuy agent in the area you want to live,http://www.homebuy.co.uk/,homebuy
add,Technology Strategy Board,The UK's innovation agency aims to accelerate economic growth by stimulating and supporting business-led innovation,http://www.innovateuk.org/,"tsb, technology strategy, technology strategy board, innovate, innovation, design, creative"
794,Motability,"Get a car, powered wheelchair or scooter at an affordable price through the Motability scheme",http://www.motability.co.uk/,motability
add,Census records - The National Archives,How to research census records from 1841 to 1911,http://www.nationalarchives.gov.uk/records/looking-for-person/recordscensus.htm,"census, family history, genealogy"
add,NHS Choices,"Information from the National Health Service on conditions, treatments, local services and healthy living",http://www.nhs.uk/,"nhs, health"
431,Carers' assessments - NHS Choices,Find out how to get a carer's assessment,http://www.nhs.uk/CarersDirect/guide/assessments/Pages/Carersassessments.aspx,"carers assessment, carer's assessment"
1558,Care homes - NHS Choices,Find a care home and other residential housing,http://www.nhs.uk/CarersDirect/guide/practicalsupport/Pages/Carehomes.aspx,"care homes, old people's homes, nursing homes, sheltered housing"
497,Carers' rights - NHS Choices,Find out your legal rights as a carer,http://www.nhs.uk/CarersDirect/guide/rights/Pages/carers-rights.aspx,"carer's rights, carers rights, carer rights"
add,Suicide - NHS Choices,Getting help if you're having suicidal thoughts or you're worried about someone else,http://www.nhs.uk/conditions/Suicide,"suicide, suicidal, samaritans"
add,EHIC - NHS Choices,Apply for a free European Health Insurance Card (EHIC) or renew your card for emergency healthcare in Europe,http://www.nhs.uk/ehic,"ehic, e111, european health insurance card, european health card, travel abroad, travel insurance"
add,Prescriptions and health costs - NHS Choices,Find out what you are entitled to and how to get help with health costs,http://www.nhs.uk/healthcosts,"prescription, prescriptions, hc11, hc1, hc2, health costs, dental costs, eye care, eye test, eye tests, sight tests, treatment"
1544,Counselling - NHS Choices,Find out about talking therapies and find a counsellor or another therapist in your area,http://www.nhs.uk/livewell/counselling,"counsellor, counselling"
add,Health services near you - NHS Choices,"Enter your postcode or location to find a GP, hospital, dentist or other health service in your area",http://www.nhs.uk/service-search,"doctor, gp, surgery"
add,NHS Direct and NHS 111,"NHS Direct is being replaced by NHS 111 in England - if you need medical help fast but it's not a 999 emergency, call 111 or 0845 4647 depending on your area",http://www.nhsdirect.nhs.uk/,"nhs, health, medical, urgent, 111"
998,National Savings and Investments - NS&I,Invest with the government's savings scheme on the National Savings and Investments (NS&I) website,http://www.nsandi.com/,"ns&i, nsandi, national savings and investments"
972,Premium Bonds - NS&I,Buy Premium Bonds on the National Savings and Investments (NS&I) website,http://www.nsandi.com/savings-premium-bonds,"premium bonds, premium bond numbers, ns&i, national savings and investments"
add,NSPCC,"Help and advice if you're worried about a child, from the National Society for the Prevention of Cruelty to Children (NSPCC)",http://www.nspcc.org.uk/,"child abuse, neglect, cruelty, nspcc, childline, child protection, child safety, safeguarding children"
add,2011 Census - Office for National Statistics,Information about the 2011 Census from the Office for National Statistics,http://www.ons.gov.uk/census,"census, ons"
add,Find local councillors - Openly Local,Openly Local is a new project providing easier access to local government information (not all councils are listed yet),http://www.openlylocal.com/,councillor
766,Find your local policing team - Police UK,Find details of your local policing team on the Police UK website,http://www.police.uk/,"local police, neighbourhood police"
165,Crime in your area - Police UK,Get crime maps and statistics for your area,http://www.police.uk/,"crime, crime maps, crime statistics"
495,Beaches with lifeguards - RNLI,Find a beach with a lifeguard on the Royal National Lifeboat Institute (RNLI) website,http://www.rnli.org/findmynearest/,"lifeguards, safe beaches, beach safety, life-guards"
1917,UCAS applications,"Apply for a higher education course, track your application and accept or reject your offers",http://www.ucas.ac.uk/,"ucas, ucas applications, university"
119,UK transit visas - UK Border Agency,Apply for a UK transit visa on the UK Border Agency website,http://www.ukba.homeoffice.gov.uk/visas-immigration/visiting/transit/,"uk transit visas, transit visas, transit without visa, twov"
add,Victim Support,"Free and confidential help for victims of crime, witnesses, their family, friends and anyone else affected",http://www.victimsupport.org/,"victim, victims, crime, witness, witnesses"
174,Contact your MP - WriteToThem,"Send a message to your MP (or your councillor, MEP, MSP or AM) through the WriteToThem website",http://www.writetothem.com/,"local mp, my mp, your mp, member of parliament, write, email"
add,GOV.UK blogs,Blogs where government organisations talk about their work and share information and ideas,https://blog.gov.uk/,"blog, blogs, blogging, bringing dsa and vosa together, civil service quarterly, connecting to patients and people who use services, dvla digital services, dwp digital, gov.uk transition, history of government, hmrc transition, inside gov.uk, jon rouse, mary agnew, matters of testing, public health matters, social care"
add,Travelling to the United States - ESTA,British travellers to the US must register with the Electronic System for Travel Authorisation (ESTA) before their journey,https://esta.cbp.dhs.gov/,esta
164,Careers advice - National Careers Service,Plan your career and find a careers adviser,https://nationalcareersservice.direct.gov.uk/,"careers advice, career advice, jobs advice"
add,Lifelong Learning Account - National Careers Service,"Update and store your CV, skills, courses and qualifications all in one place",https://nationalcareersservice.direct.gov.uk/account/,lifelong learning
add,Courses and learning - National Careers Service,Information on learning and qualifications for work,https://nationalcareersservice.direct.gov.uk/advice/courses/,training
1426,Write your CV - National Careers Service,Get CV writing tips and use the step-by-step CV builder,https://nationalcareersservice.direct.gov.uk/advice/getajob/cvs/,"cv, c v, c.v, c.v., curriculum vitae, job, jobs, jobmatch, jobsearch"
add,Write a covering letter  - National Careers Service,Help writing a covering letter for a job application,https://nationalcareersservice.direct.gov.uk/advice/getajob/cvs/Pages/writeacoveringletter.aspx,"covering letter, cover letter, covering letters, cover letters, letter template, letter templates"
add,Looking for a job - National Careers Service,Tips on where to look for a job and planning your job search,https://nationalcareersservice.direct.gov.uk/advice/getajob/howtofindajob/,"job, jobs, jobmatch, jobsearch, jobseekers"
add,Interviews - National Careers Service,Tips on preparing for job interviews,https://nationalcareersservice.direct.gov.uk/advice/getajob/interviews/,"interview, interviews"
add,Improving your skills - National Careers Service,Tips on how to make the most of your strengths and brush up on your skills,https://nationalcareersservice.direct.gov.uk/tools/skillshealthcheck/,"skills, skills health check, cv, c v"
add,Fire Kills,Advice on how to prevent fires and protect yourself,https://www.facebook.com/firekills,"fire safety, fire kills, firekills"
528,National Citizen Service - Facebook,Sign up for National Citizen Service (NCS) on Facebook,https://www.facebook.com/ncs,"ncs, national citizen service"
add,GDS design principles,The Government Digital Service (GDS) guidelines for anyone building digital services for the GOV.UK domain,https://www.gov.uk/designprinciples,"gel, global experience language, design principles"
add,GDS style guide,The Government Digital Service (GDS) style guide for written content on the GOV.UK website,https://www.gov.uk/designprinciples/styleguide,"style guide, style guidelines, house style, content principles, editorial guidelines, writing styles, government, whitehall"
add,Performance Platform,View the latest data about the performance of the GOV.UK website and transactional services,https://www.gov.uk/performance,"performance platform, performance dashboard, data dashboard, gds"
add,Government Service Design Manual,"From April 2014, digital services from the government must meet the new Digital by Default Service Standard",https://www.gov.uk/service-manual,"service design, design manual, service manual, digital by default, service standards, design principles, digital services, digital delivery, service managers, agile, discovery, alpha, beta, guidance, guidelines, gds, gov.uk"
add,Money Advice Service,"Free, unbiased, independent advice and tools to help you manage your money better",https://www.moneyadviceservice.org.uk/,"money advice, financial advice, finances, ma, mas"
add,Reclaiming mis-sold PPI - Money Advice Service,Find out how to claim compensation if you think you've been mis-sold payment protection insurance (PPI),https://www.moneyadviceservice.org.uk/en/articles/reclaiming-payment-protection-insurance,ppi
add,Debt management - Money Advice Service,"How to prioritise and reduce your debts, and where to get free debt advice",https://www.moneyadviceservice.org.uk/en/categories/managing-debt,"debt, debts, advice, advise, help, managing, problems, late payment, credit rating, loan, rent arrears, mortgage"
